{
  "loop_id": "<project-id>:weekly-triage",
  "name": "每周任务整理",
  "status": "draft",
  "project_id": "<project-id>",
  "workstream_id": "<project-id>:daily-development",
  "trigger": { "type": "cron", "expression": "0 21 * * 0", "timezone": "Asia/Shanghai", "event": null },
  "collect": { "source": "github_issues" },
  "filter": {},
  "action": { "create_task_status": "backlog" },
  "guardrails": { "risk_ceiling": "medium", "max_tasks_per_run": 10, "deduplicate": true, "requires_review": true },
  "fallback": { "on_empty": "no_op", "on_failure": "notify", "on_no_human_review": "stay_in_backlog" },
  "updated_at": "yyyy-mm-dd"
}
